pathway	pval	padj	log2err	ES	NES	size	leadingEdge
HALLMARK_ADIPOGENESIS	0.0425963488843813	0.194174757281553	0.219250346703755	0.287332777300782	1.50021355513483	64	Cmbl Ddt Chchd10 Sult1d1 Hadh Tst Ephx2 Phyh Acaa2 Scp2 Mrap Aldh1b1 Suclg1 Acads Ech1 Cpt2 Acadm Fah Aldh1a7 Orm1 Echs1 Gbe1 Sult1a1 Prdx3 Etfb Uqcrq Cox7b Decr1 Me1 Reep6 Coq9 Qdpr Idh2 Sdhb
HALLMARK_ALLOGRAFT_REJECTION	0.803986710963455	0.882164397725314	0.0808589150280032	-0.273716951788491	-0.745653956242779	5	Nme1 H2-Q10 Eif5a Mbl2 Zap70
HALLMARK_ANDROGEN_RESPONSE	0.305590062111801	0.647131896236756	0.0799858801499946	0.346505191490413	1.13637667709707	11	Hmgcs2 Dbi Aldh1b1 Aldh1a7 Sord Hmgcs1 Krt8
HALLMARK_APICAL_JUNCTION	0.122670807453416	0.490683229813665	0.156312403073186	0.666666666666667	1.3610597302641	3	Hadh Zap70 Gamt
HALLMARK_APICAL_SURFACE	0.0175393940316747	0.126283637028058	0.352487857583619	0.776744186046512	1.58579284851701	3	Gstm1 Gstm6 Gstm7
HALLMARK_APOPTOSIS	0.302774427020507	0.647131896236756	0.0789209638180035	0.329273751124788	1.15267546529244	13	Gstm1 Gstm6 Cth Dap Gstm7 Gpx1 Gch1 Krt18
HALLMARK_BILE_ACID_METABOLISM	0.00106495989053926	0.0156672680134629	0.45505986738723	0.397030089252461	1.87089662255197	36	Bbox1 Ephx2 Phyh Gnmt Hacl1 Akr1d1 Pecr Hao1 Scp2 Pxmp2 Agxt Aldh8a1 Sult2a8 Aldh1b1 Gclm Amacr
HALLMARK_CHOLESTEROL_HOMEOSTASIS	0.00186639260497625	0.0167975334447862	0.45505986738723	0.529716409756496	1.98606291158721	16	Adh1 Gstm1 Hmgcs2 Acat3 Gstm6 Adh4 Adh5 Ech1 Acat2 Gstm7 Ethe1 Cbs Hmgcs1 Fdps
HALLMARK_COAGULATION	0.550660792951542	0.804349445147837	0.0456790414930062	0.214374278690733	0.932612248039008	26	Rgn Hmgcs2 Apoc1 Apoc3 Serpina1b Serpina1e Serpina1c C9 Serpina1a Hmgcs1 Serpina1d Acox2 Tfpi2 Mbl2 Apoa1 C8g Cfhr2 Cpb2 Hrg
HALLMARK_COMPLEMENT	0.195922989807475	0.587768969422424	0.0999276973731092	0.320405480318935	1.2760335255663	19	Apoc1 Serpina1b Msrb1 Lap3 Serpina1e Serpina1c C9 Serpina1a Me1 Serpina1d Fdx1
HALLMARK_DNA_REPAIR	0.827242524916944	0.882164397725314	0.0793434960134973	-0.266496834636087	-0.725985065134469	5	Guk1 Nme1 Edf1
HALLMARK_E2F_TARGETS	0.94468085106383	0.94468085106383	0.0855356947987884	-0.175	-0.62152959130957	8	Pa2g4 Nme1 Ak2 Shmt2 Dctpp1 Cks2 Tubb2a Shmt1
HALLMARK_EPITHELIAL_MESENCHYMAL_TRANSITION	0.483594864479315	0.798364265492293	0.0637845390312975	0.397522191707377	0.99078691388148	5	Inmt Dpys Nnmt Tfpi2
HALLMARK_ESTROGEN_RESPONSE_EARLY	0.276349614395887	0.647131896236756	0.0873098257637931	0.378360406847192	1.16765779523318	9	Sult2a8 Dhrs4 Tubb2a Chpt1 Krt8 Krt18 Sec14l2
HALLMARK_ESTROGEN_RESPONSE_LATE	0.0431499460625674	0.194174757281553	0.224966093540314	0.352171732077321	1.58932710927924	30	Ass1 Tst Hmgcs2 Sult2a8 Perp Serpina1b Serpina1e Serpina1c Dhrs4 Sord Etfb Serpina1a Hmgcs1 Chpt1 Serpina1d Idh2 Acox2 Dcxr Mpst Mocs2 Idh1 Ugdh Tfpi2 Cyp4a10 Hspb8 Serpina3m
HALLMARK_FATTY_ACID_METABOLISM	4.50833952822526e-06	0.000162300223016109	0.610526878385931	0.418054552134703	2.21476161132678	71	Fabp1 Bphl Hadh Pcbd1 Fabp2 Aadat Adh1 Eci1 Acaa2 Hmgcs2 Gpd1 Prdx6 Acat3 Inmt Bckdhb Adh4 Aldh1b1 Gcdh Gstz1 Mdh1 Suclg1 Acads Etfdh Adh5 Ech1 Hsd17b10 Acat2 Cpt2 Acadm Grhpr Cryz Fh1 Aldh1a7 Suclg2 Echs1 Hmgcl Hsd17b4 Aldh9a1 Acaa1b Nnmt Decr1 Cbr1 Me1 Reep6 Sdhd Hmgcs1
HALLMARK_GLYCOLYSIS	0.642162162162162	0.804349445147837	0.037770500132479	0.190499953107629	0.865527499494547	31	Aldob Fbp1 Aldh7a1 Mdh1 Cth Aldh9a1 Ugp2 Cyb5a Dpys Ak3 Me1 Tpi1 Idh2 Got2 Sdhc Mif Idh1 Got1
HALLMARK_HEME_METABOLISM	0.487889273356401	0.798364265492293	0.053347785067549	0.257531927682825	0.989093386203542	17	Selenbp2 Gclm Selenbp1 Hebp1 Alas2 Hagh Aldh6a1 Aldh1l1 Nudt4 Alad Prdx1 Glrx5 Dcaf11 Rcl1
HALLMARK_HYPOXIA	0.178251121076233	0.587768969422424	0.105125131597001	0.312518541848627	1.2886189004642	22	Aldob Fbp1 Selenbp2 Sult2a8 Selenbp1 Gapdh Grhpr Gbe1 Ugp2 Dpys Ak3 Tpi1
HALLMARK_IL2_STAT5_SIGNALING	0.335071707953064	0.670143415906128	0.0776798560117236	0.3785075965597	1.11898632731699	8	Amacr Ahcy Fah Galm
HALLMARK_INTERFERON_GAMMA_RESPONSE	0.809775429326288	0.882164397725314	0.0363018462359236	0.246489859594384	0.696336498624443	7	Lap3 Gch1 Sod2 Cfhr2 Mettl7a1 Mettl7b H2-Q10
HALLMARK_KRAS_SIGNALING_DN	0.7125	0.855	0.0840745577910723	-0.33695652173913	-0.815967201258612	4	Igfbp2 Fggy Nudt4 Gamt
HALLMARK_KRAS_SIGNALING_UP	0.395886889460154	0.712596401028278	0.0684714904492088	0.339694874955966	1.04833212345944	9	Arg1 Aldh1b1 Aldh1a7 Crot Rbp4 Serpina3m Aldh2 Cfhr2
HALLMARK_MTORC1_SIGNALING	0.377136752136752	0.712596401028278	0.0618406035753285	0.235325658587006	1.08504525994485	33	Ppa1 Hmgcs2 Shmt1 Tuba4a Gapdh Cth Gbe1 Sord Ak3 Atp5g1 Hspd1 Me1 Hmgcs1 Tpi1 Qdpr Idh2
HALLMARK_MYC_TARGETS_V1	0.0237094961791161	0.142256977074697	0.352487857583619	-0.28548644338118	-1.6291061447683	21	Eif4a1 Vdac1 Pgk1 Psmd8 Pa2g4 Ap3s1 Mrps18b Cox5a Nme1 Phb2 Rps2 Acp1 Ldha Cyc1 C1qbp Ndufab1 Hspe1 Got2 Glo1 Hspd1 Prdx3
HALLMARK_MYC_TARGETS_V2	0.597826086956522	0.804349445147837	0.102821842840815	-0.289719626168224	-0.878982429401142	6	Pa2g4 Rcl1 Dctpp1 Hspe1 Hspd1 Sord
HALLMARK_MYOGENESIS	0.187234042553192	0.587768969422424	0.213927855492356	-0.346875	-1.23196043991718	8	Eif4a1 Pgam1 Psen2 Igf1 Pygl Hspb8 Fdps Fxyd1
HALLMARK_OXIDATIVE_PHOSPHORYLATION				-0.101112894579283		103	Ndufb8 Atp5l Ndufb7 Ndufs4 Ndufa1 Ndufa8 Vdac1 Ndufs8 Atp5g2 Idh3b Timm13 Cox8a Cox7c Acaa1a Mrpl11 Cox5a Slc25a13 Mrps12 Ndufa5 Ndufa2 Ndufb4 Mrpl34 Phb2 Ndufa9 Cox6c Uqcrc1 Ndufc1 Oat Atp5a1 Mdh2 Sucla2 Mrpl15 Cox7a2 Cox5b Mrps15 Hspa9 Ndufs6 Atp5j2 Uqcr11 Ndufb6 Ldha Glud1 Mtx2 Uqcr10 Atp5j Uqcrb Cyc1 Cox6b1 Iscu Mrpl35 Ndufs2 Grpel1 Ndufa4 Atp5c1 Ndufv2 Ndufa6 Ndufs3 Slc25a5 Atp5o Ndufv1 Ndufb2 Atp5e Timm8b Atp5k Bckdha Atp5d Ndufab1 Idh1 Atp5b Sdhc Got2 Cycs Acadvl Cyb5r3 Uqcrfs1 Sdhb Idh2 Fdx1 Sdhd Aldh6a1 Atp5g1 Decr1 Cox7b Uqcrq Acaa1b Cyb5a Etfb Prdx3 Alas2 Echs1 Fh1 Acadm Hsd17b10 Ech1 Mpc1 Etfdh Suclg1 Mdh1
HALLMARK_P53_PATHWAY	0.54950495049505	0.804349445147837	0.129442887745046	-0.232932532397075	-0.93107490000559	10	Tprkb Rps27l Hint1 Fam162a Ninj1 Iscu Gls2 Ei24 Dcxr
HALLMARK_PEROXISOME	0.647948164146868	0.804349445147837	0.0373029764832679	0.191499019170316	0.858741969037697	29	Ephx2 Scp2 Sult2a8 Aldh1b1 Ech1 Aldh1a7 Hmgcl Hsd17b4 Aldh9a1 Acaa1b Ttr Idh2 Fdps Aldh1a1 Idh1 Sod2 Prdx1 Mlycd Aldh2 Slc25a5 Prdx5 Eci2
HALLMARK_PROTEIN_SECRETION	0.615942028985507	0.804349445147837	0.100990587455923	-0.284796072489878	-0.864044824963646	6	Cltb Rab9 Ap3s1
HALLMARK_REACTIVE_OXYGEN_SPECIES_PATHWAY	0.857659831121834	0.882164397725314	0.0291395520262835	0.191035373867632	0.668749900980522	13	Msra Prdx6 Gclm
HALLMARK_SPERMATOGENESIS	0.29986962190352	0.647131896236756	0.0835990603684159	0.38688946334252	1.14376573574265	8	Gstm1 Gstm6 Tuba4a Gstm7 Elovl3 Tuba1c
HALLMARK_TNFA_SIGNALING_VIA_NFKB	0.581395348837209	0.804349445147837	0.0992333343771191	-0.32348367029549	-0.881227402832375	5	Ninj1 Kynu Sod2 Gch1 Tubb2a
HALLMARK_UNFOLDED_PROTEIN_RESPONSE	0.215946843853821	0.598006644518272	0.173747838999571	-0.443513036197757	-1.20820887389412	5	Eif4a1 Tars Hspa9 Serp1
HALLMARK_UV_RESPONSE_UP	0.85761957730812	0.882164397725314	0.024919740580511	0.155075568618294	0.665312031416266	25	Cdo1 Sult1d1 Tst Tuba4a Alas2 Sult1a1 Acaa1b Gch1 Mpst Apom Tuba1c Spr Sod2
HALLMARK_XENOBIOTIC_METABOLISM	0.00130560566778857	0.0156672680134629	0.45505986738723	0.328021655227141	1.76775156960784	78	Gsta2 Fabp1 Cdo1 Ddt Bphl Fbp1 Arg1 Akr1c12 Gsta3 Gnmt Hacl1 Adh1 Gstm1 Upb1 Akr1c14 Akr1c6 Ttpa Angptl3 Gstm6 Adh4 Aldh1b1 Shmt1 Ahcy Etfdh Adh5 Ech1 Gss Fah Gstm7 Aldh1a7 Alas2 Aldh9a1 Cyb5a Akr1c13 Akr1c19 Cbr1 Gch1 Tkfc Idh2 Ndrg2 Acox2 Dcxr Leap2 Crot Asl
